{"version":"canon_geo_evidence_compilation.v0","request_version":"canon_geo_evidence_request.v0","composition_request":{"version":"canon_geo_composition_request.v0","profile":{"version":"canon_geo_composition_profile.v0","selection_level":"parcel"},"universe":{"parcels":["4066300015","4066300030","4066307501"],"buildings":[]},"hard_constraints":[{"id":"rho:rho.address.pad.membership@1.0.0:obs.address.pad.membership:h7-subject:non-round:97ae3eeb8035a1914b178d2cf3a447b50735e954a33067d57d6e9a5e1c3e6d58","constraint":{"kind":"any_of","members":[{"level":"parcel","id":"4066300015"}]}}],"soft_preferences":[],"max_assignments":1000000,"max_materialized_models":1000000},"admissions":[{"observation_id":"obs.address.pad.membership:h7-subject:non-round:97ae3eeb8035a1914b178d2cf3a447b50735e954a33067d57d6e9a5e1c3e6d58","contract":{"id":"rho.address.pad.membership","version":"1.0.0","source_dataset":"SOURCE.NYC_DCP_PAD_ADDRESS_HOT","source_release":"26B","source_lineage_ids":["SOURCE.NYC_DCP_PAD_ADDRESS_HOT:26B"],"method_id":"address-parse-pad-membership-bridge","method_version":"1.0.0","claim_role":"stable_identity_anchor","basis":{"kind":"logical_relaxation","invariant_id":"pad-member-implies-parcel-address-membership"}},"source_records":[{"source_record_id":"EDGAR_DB.SOURCE.NYC_DCP_PAD_ADDRESS_HOT:26B:2026-05-01:837621:4066300015","source_vintage":"26B/2026-05-01","record_blake3":"f8d4f292494290767cb36208c9e64740f8bf27d7343916bdcd06adf8dc6aa9f9"}],"observation":{"kind":"existential_membership","members":[{"level":"parcel","id":"4066300015"}]},"disposition":"hard_constraint","generated_ids":["rho:rho.address.pad.membership@1.0.0:obs.address.pad.membership:h7-subject:non-round:97ae3eeb8035a1914b178d2cf3a447b50735e954a33067d57d6e9a5e1c3e6d58"]}]}