{"version":"canon_geo_evidence_compilation.v0","request_version":"canon_geo_evidence_request.v0","composition_request":{"version":"canon_geo_composition_request.v0","profile":{"version":"canon_geo_composition_profile.v0","selection_level":"parcel"},"universe":{"parcels":["1010370001","1010370002","1010370003","1010370004","1010370005","1010370006","1010370007","1010370008","1010370009","1010370010","1010370012","1010370013","1010370014","1010370015","1010370020","1010370023","1010370024","1010370025","1010370026","1010370029","1010370034","1010370035","1010370036","1010370037","1010370038","1010370040","1010370043","1010370045","1010370046","1010370047","1010370048","1010370049","1010370050","1010370051","1010370052","1010370053","1010370054","1010370056","1010370057","1010370058","1010370059","1010370061","1010370062","1010370063","1010370064","1010370101","1010370102","1010370103","1010370105","1010370106","1010370109","1010370113","1010377501","1010377502","1010720001","1010720010","1010720015","1010720021","1010720029","1010720032","1010720033","1010720036","1010720042","1010720044","1010720045","1010720050","1010720059","1010720135","1010720136","1010720137","1010727501","1011390001","1011390008","1011390014","1011390057","1011390107","1011397501","1011397502","1011397503","1012420001","1012420002","1012420003","1012420009","1012420010","1012420024","1012420029","1012420031","1012420033","1012420034","1012420036","1012420039","1012420040","1012420041","1012420042","1012420055","1012420062","1012420128","1012427501","1020310003","1020310007","1020310012","1020310014","1020310017","1020310018","1020310020","1020310023","1020310029","1020310031","1020310033","1020310035","1020310037","1020310038","1020310044","1020310053","1020310054","1020590001","1020590003","1020590004","1020590005","1020590006","1020590007","1020590008","1020590009","1020590011","1020590012","1020590013","1020590014","1020590015","1020590016","1020590017","1020590018","1020590019","1020590020","1020590021","1020590022","1020590023","1020590024","1020590025","1020590026","1020590027","1020590028","1020590030","1020590031","1020590032","1020590033","1020590034","1020590035","1020590036","1020590037","1020590038","1020590039","1020590040","1020590041","1020590042","1020590043","1020590044","1020590047","1020590048","1020590049","1020590050","1020590051","1020590052","1020590053","1020590054","1020590055","1020590056","1020590057","1020590058","1020590059","1020590060","1020590061","1020590104","1020590106","1020590111","1020590135","1020590150","1020590151","1020590152","1020590154","1020590156","1020590158","1020597501","1020597502","1020597503"],"buildings":[]},"hard_constraints":[{"id":"rho:rho.address.pad.membership@1.0.0:obs.address.pad.membership:h7-subject:non-round:4bb51b76b9a709ec6f9cc298ac7e441f77a1320ee4edac1124efa9b11c05293f","constraint":{"kind":"any_of","members":[{"level":"parcel","id":"1010370062"},{"level":"parcel","id":"1010720029"},{"level":"parcel","id":"1011390001"},{"level":"parcel","id":"1012420031"},{"level":"parcel","id":"1020590032"}]}}],"soft_preferences":[],"max_assignments":1000000,"max_materialized_models":1000000},"admissions":[{"observation_id":"obs.address.pad.membership:h7-subject:non-round:4bb51b76b9a709ec6f9cc298ac7e441f77a1320ee4edac1124efa9b11c05293f","contract":{"id":"rho.address.pad.membership","version":"1.0.0","source_dataset":"SOURCE.NYC_DCP_PAD_ADDRESS_HOT","source_release":"26B","source_lineage_ids":["SOURCE.NYC_DCP_PAD_ADDRESS_HOT:26B"],"method_id":"address-parse-pad-membership-bridge","method_version":"1.0.0","claim_role":"stable_identity_anchor","basis":{"kind":"logical_relaxation","invariant_id":"pad-member-implies-parcel-address-membership"}},"source_records":[{"source_record_id":"EDGAR_DB.SOURCE.NYC_DCP_PAD_ADDRESS_HOT:26B:2026-05-01:29156:1010370062","source_vintage":"26B/2026-05-01","record_blake3":"0f0654e38aead7f885d289986738ab9ba3d755403062bb6f273fd5e8b244fc33"},{"source_record_id":"EDGAR_DB.SOURCE.NYC_DCP_PAD_ADDRESS_HOT:26B:2026-05-01:30549:1010720029","source_vintage":"26B/2026-05-01","record_blake3":"ccb992246ac7988013c32974aa847bd74f5e33c75ff91be9f716f22e0e745b92"},{"source_record_id":"EDGAR_DB.SOURCE.NYC_DCP_PAD_ADDRESS_HOT:26B:2026-05-01:32252:1011390001","source_vintage":"26B/2026-05-01","record_blake3":"918fb4038a389499a34666423240309852c550704040fa6d12e62cebf672ba1c"},{"source_record_id":"EDGAR_DB.SOURCE.NYC_DCP_PAD_ADDRESS_HOT:26B:2026-05-01:35806:1012420031","source_vintage":"26B/2026-05-01","record_blake3":"5986a09515d92c0a97d4afff6ba730d96beecf8f75cb8ecbca76285bd183c531"},{"source_record_id":"EDGAR_DB.SOURCE.NYC_DCP_PAD_ADDRESS_HOT:26B:2026-05-01:62937:1020590032","source_vintage":"26B/2026-05-01","record_blake3":"c91cf7dfc07000ba3dfb2436e2ceceb994be3bd868852f957a8f81339d1feae2"}],"observation":{"kind":"existential_membership","members":[{"level":"parcel","id":"1010370062"},{"level":"parcel","id":"1010720029"},{"level":"parcel","id":"1011390001"},{"level":"parcel","id":"1012420031"},{"level":"parcel","id":"1020590032"}]},"disposition":"hard_constraint","generated_ids":["rho:rho.address.pad.membership@1.0.0:obs.address.pad.membership:h7-subject:non-round:4bb51b76b9a709ec6f9cc298ac7e441f77a1320ee4edac1124efa9b11c05293f"]}]}