{"version":"canon_geo_evidence_compilation.v0","request_version":"canon_geo_evidence_request.v0","composition_request":{"version":"canon_geo_composition_request.v0","profile":{"version":"canon_geo_composition_profile.v0","selection_level":"parcel"},"universe":{"parcels":["2057230040","2057230042","2057230066","2057230075","2057230084","2057230088","2057230090","2057230091","2057230092","2057230093","2057230094","2057230100","2057237501"],"buildings":[]},"hard_constraints":[],"soft_preferences":[],"max_assignments":1000000,"max_materialized_models":1000000},"admissions":[]}