{"version":"canon_geo_evidence_compilation.v0","request_version":"canon_geo_evidence_request.v0","composition_request":{"version":"canon_geo_composition_request.v0","profile":{"version":"canon_geo_composition_profile.v0","selection_level":"parcel"},"universe":{"parcels":["1004180001","1004180031","1004180032","1004180033","1004180034","1004180035","1004180036","1004180037","1004180039","1004180040","1004180042","1004180043","1004180044","1004180046","1004180047","1004180048","1004180050","1004180051","1004180054","1004180055","1004180056","1004180057","1004180058","1004187501","3087737501"],"buildings":[]},"hard_constraints":[{"id":"rho:rho.address.pad.membership@1.0.0:obs.address.pad.membership:h7-subject:round-exact-lender:69dbf5dad6b0ea938a91beeff6e9efb3edd9b090b7bc857b1a2646244c3ba394","constraint":{"kind":"any_of","members":[{"level":"parcel","id":"1004180001"},{"level":"parcel","id":"1004180032"},{"level":"parcel","id":"1004180033"}]}}],"soft_preferences":[],"max_assignments":1000000,"max_materialized_models":1000000},"admissions":[{"observation_id":"obs.address.pad.membership:h7-subject:round-exact-lender:69dbf5dad6b0ea938a91beeff6e9efb3edd9b090b7bc857b1a2646244c3ba394","contract":{"id":"rho.address.pad.membership","version":"1.0.0","source_dataset":"SOURCE.NYC_DCP_PAD_ADDRESS_HOT","source_release":"26B","source_lineage_ids":["SOURCE.NYC_DCP_PAD_ADDRESS_HOT:26B"],"method_id":"address-parse-pad-membership-bridge","method_version":"1.0.0","claim_role":"stable_identity_anchor","basis":{"kind":"logical_relaxation","invariant_id":"pad-member-implies-parcel-address-membership"}},"source_records":[{"source_record_id":"EDGAR_DB.SOURCE.NYC_DCP_PAD_ADDRESS_HOT:26B:2026-05-01:9406:1004180001","source_vintage":"26B/2026-05-01","record_blake3":"2199e138849e9a52d75b0f81407262dbb81bdd93f308d44988683a39bfa2ea1b"},{"source_record_id":"EDGAR_DB.SOURCE.NYC_DCP_PAD_ADDRESS_HOT:26B:2026-05-01:9413:1004180032","source_vintage":"26B/2026-05-01","record_blake3":"4e344476f2e633865c56578c3636090826db4e26c168a6b528676c749355ac12"},{"source_record_id":"EDGAR_DB.SOURCE.NYC_DCP_PAD_ADDRESS_HOT:26B:2026-05-01:9415:1004180033","source_vintage":"26B/2026-05-01","record_blake3":"4596face259240d186a94f2f68c3eaff59f9ef39e5a6832655d7f5104472cb0b"}],"observation":{"kind":"existential_membership","members":[{"level":"parcel","id":"1004180001"},{"level":"parcel","id":"1004180032"},{"level":"parcel","id":"1004180033"}]},"disposition":"hard_constraint","generated_ids":["rho:rho.address.pad.membership@1.0.0:obs.address.pad.membership:h7-subject:round-exact-lender:69dbf5dad6b0ea938a91beeff6e9efb3edd9b090b7bc857b1a2646244c3ba394"]}]}